title;minutes;date;views
Epic Seven Karin Rhianna and Luciella (RnL) artifact in Arena;0:03:17;2021-07-22;157
Counter Side Random Recruiting Compilation;0:08:06;2021-05-22;13
Kamaitachi no Yoru Rinne Saisei Opening Movie Japanese PC version;0:02:26;2021-05-22;380
Counter Side Review in 5 minutes;0:05:10;2021-05-21;89
Epic Seven 10 Free Summons;0:02:26;2021-05-04;27
Tomb Raider 2013 Plane Crash Cutscene;0:01:39;2020-12-22;24
Beautiful scene and camera angle from Tomb Raider 2013;0:02:48;2020-12-20;20
Celeste Chapter 3 - Flying Strawberry;0:00:15;2020-08-06;20
